{
  "schemaVersion": 1,
  "slug": "camelback-moving",
  "companyName": "Camelback Moving",
  "website": "https://camelbackmoving.com/",
  "snapshotDate": "2026-10-14",
  "publicationApproved": true,
  "scope": "Scottsdale service-area page of Camelback Moving, Arizona; not a separate business called Scottsdale Movers.",
  "metrics": [
    {
      "label": "Founded / company-reported",
      "value": "2005",
      "context": "Reported on the public website; not independently audited.",
      "sourceIds": [
        "s1"
      ]
    },
    {
      "label": "Scottsdale weekday / two movers",
      "value": "$185 / hour",
      "context": "Standard posted rate, two-hour minimum. Trip charge and card surcharge separate; not an all-in quote.",
      "sourceIds": [
        "s1"
      ]
    }
  ],
  "observations": [
    {
      "title": "Turn the time-estimate worksheet into a phone-friendly tool",
      "observed": "The navigation's Moving Time Estimator opens a one-page PDF with home sizes and additions for stairs, elevators, long carries and other conditions.",
      "improvement": "Test an accessible web version with a few questions and a labelled planning range that carries into the quote request. Retain the printable PDF.",
      "sourceIds": [
        "s1",
        "s2"
      ]
    },
    {
      "title": "Use local expertise in the first enquiry",
      "observed": "The Scottsdale page explains gated communities and building move windows. Its visible quote form asks for service, name, email and phone, without move-date or access questions.",
      "improvement": "Test optional date, ZIP and gate/elevator questions. First ask how the team currently collects those details before proposing internal automation.",
      "sourceIds": [
        "s1"
      ]
    }
  ],
  "sources": [
    {
      "id": "s1",
      "label": "Scottsdale service page / posted rates",
      "url": "https://camelbackmoving.com/az/scottsdale-movers/",
      "observedOn": "2026-10-14"
    },
    {
      "id": "s2",
      "label": "Moving Time Estimator / PDF",
      "url": "https://camelbackmoving.com/wp-content/uploads/2024/10/move-time-estimator.pdf",
      "observedOn": "2026-10-14"
    }
  ],
  "limitations": [
    "The short quote form may be intentional. Test extra questions against completion and lead quality.",
    "The posted rate is not an all-in quote; promotional rates and other charges are described separately.",
    "Public website review only. No forms submitted or mobile-usability, conversion, speed or internal-system tests performed."
  ]
}
