{
  "schemaVersion": 1,
  "slug": "6th-man-movers",
  "companyName": "6th Man Movers",
  "website": "https://6thmanmovers.com/",
  "snapshotDate": "2026-10-14",
  "publicationApproved": true,
  "scope": "Nashville, Tennessee; public website and its linked social profiles.",
  "metrics": [
    {
      "label": "Instagram followers shown",
      "value": "1,014",
      "context": "Public profile count at the snapshot; not a measure of reach or engagement.",
      "sourceIds": [
        "s1"
      ]
    }
  ],
  "observations": [
    {
      "title": "Explain what happens after the estimate request",
      "observed": "The homepage asks for name, phone, email, estimated date, and origin ZIP. Nearby form copy does not explain the next step or response window.",
      "improvement": "Add a realistic follow-up expectation. Test optional destination/move-type questions against useful inquiries and completion before expanding the form.",
      "sourceIds": [
        "s2"
      ]
    },
    {
      "title": "Bring customer proof closer to the decision",
      "observed": "The hero uses a general rating message; the fuller review section appears after substantial Nashville guide content.",
      "improvement": "Test one short, attributed review and a direct review link beside the form. Keep the detailed city guides available.",
      "sourceIds": [
        "s2"
      ]
    }
  ],
  "sources": [
    {
      "id": "s1",
      "label": "Officially linked Instagram / snapshot count",
      "url": "https://www.instagram.com/6thmanmovers/",
      "observedOn": "2026-10-14"
    },
    {
      "id": "s2",
      "label": "Homepage / estimate form and review placement",
      "url": "https://6thmanmovers.com/",
      "observedOn": "2026-10-14"
    }
  ],
  "limitations": [
    "Public social previews and counts do not establish complete posting frequency, reach or engagement.",
    "Public website review only. No forms submitted or mobile-usability, conversion, speed or internal-system tests performed."
  ]
}
