{
  "schemaVersion": 1,
  "slug": "3-men-movers",
  "companyName": "3 Men Movers",
  "website": "https://www.3menmovers.com/",
  "snapshotDate": "2026-10-14",
  "publicationApproved": true,
  "scope": "Texas-wide moving brand; the corporate booking flow and Austin service page were reviewed.",
  "metrics": [
    {
      "label": "Advertised booking deposit",
      "value": "$25",
      "context": "Advertised website amount, not a total quote. Booking terms were not tested.",
      "sourceIds": [
        "s1"
      ]
    },
    {
      "label": "Listed Texas office cities",
      "value": "4",
      "context": "Company-reported: Houston, Austin, Dallas and San Antonio. Not independently audited.",
      "sourceIds": [
        "s1"
      ]
    }
  ],
  "observations": [
    {
      "title": "Connect low-commitment estimates to booking",
      "observed": "The opening booking screen asks for origin, destination, name, email and phone before Start Booking. A separate Move Calculator is already offered on the site.",
      "improvement": "Test an estimate-first option beside the inputs while retaining direct booking. Compare completion and qualified bookings; mobile usability was not tested.",
      "sourceIds": [
        "s2",
        "s1"
      ]
    },
    {
      "title": "Give scale claims a clear scope and date",
      "observed": "The same homepage says 37,000+ Texas families move with the company each year, while its residential section says 30,000.",
      "improvement": "Reconcile the figures or label their periods and customer groups. Reuse a dated, consistently scoped proof point.",
      "sourceIds": [
        "s1"
      ]
    }
  ],
  "sources": [
    {
      "id": "s1",
      "label": "Homepage / published claims",
      "url": "https://www.3menmovers.com/",
      "observedOn": "2026-10-14"
    },
    {
      "id": "s2",
      "label": "Booking / opening step",
      "url": "https://www.3menmovers.com/book-now/",
      "observedOn": "2026-10-14"
    }
  ],
  "limitations": [
    "Only the opening booking step was inspected. Prices, availability, payment and successful form delivery were not tested.",
    "The annual-volume figures may concern different periods or groups; the underlying statistics were not independently verified.",
    "Public website review only. No forms submitted or mobile-usability, conversion, speed or internal-system tests performed."
  ]
}
